{
    "$schema": "../skill.schema.json",
    "version": 1,
    "name": "Horse Maneuver",
    "wit_effectiveness": 1.0,
    "conditions": {
        "phase": "MID"
    },
    "effects": {
        "boost": {
            "speed": {
                "min": 50.0,
                "max": 100.0
            }
        }
    }
}